{
  "task_id": "smoke_jsoup_1",
  "decision": "fail",
  "failure_stage": "static_validation",
  "symptom": "project compile failed",
  "location": {
    "file_path": "src/main/java/org/jsoup/Jsoup.java",
    "class_name": "Jsoup",
    "method_name": "parse",
    "line_span": null
  },
  "risk_level": "high",
  "suggested_fix": "Retry with smaller patch scope and targeted fix.",
  "should_retry": false,
  "recommended_agent": "method_refactorer",
  "forbidden_actions_next_round": [
    "broad architectural rewrite",
    "ignore tool failures"
  ],
  "tool_observations": [
    {
      "tool_name": "patch_tool",
      "operation": "apply_patch",
      "status": "error",
      "error_code": "PATCH_CHECK_FAILED",
      "message": "git apply --check failed.",
      "artifacts": {
        "applied": false,
        "check_pass": false,
        "stderr": "error: No valid patches in input (allow with \"--allow-empty\")\n",
        "returncode": 128
      },
      "timestamp": "2026-04-15T05:25:28.414780+00:00"
    },
    {
      "tool_name": "ast_tool",
      "operation": "parse_java",
      "status": "ok",
      "error_code": null,
      "message": "Heuristic parse success.",
      "artifacts": {
        "parsed": true,
        "engine": "heuristic"
      },
      "timestamp": "2026-04-15T05:25:28.416697+00:00"
    },
    {
      "tool_name": "build_tool",
      "operation": "compile_module",
      "status": "error",
      "error_code": "EXCEPTION",
      "message": "[WinError 2] 系统找不到指定的文件。",
      "artifacts": {},
      "timestamp": "2026-04-15T05:25:28.424695+00:00"
    },
    {
      "tool_name": "build_tool",
      "operation": "compile_project",
      "status": "error",
      "error_code": "EXCEPTION",
      "message": "[WinError 2] 系统找不到指定的文件。",
      "artifacts": {},
      "timestamp": "2026-04-15T05:25:28.435035+00:00"
    },
    {
      "tool_name": "test_tool",
      "operation": "run_targeted_tests",
      "status": "error",
      "error_code": "EXCEPTION",
      "message": "[WinError 2] 系统找不到指定的文件。",
      "artifacts": {},
      "timestamp": "2026-04-15T05:25:28.458934+00:00"
    },
    {
      "tool_name": "smell_detector_tool",
      "operation": "detect_target_smell",
      "status": "degraded",
      "error_code": null,
      "message": "No detector configured; using fallback.",
      "artifacts": {
        "smell_removed": true,
        "detector_used": []
      },
      "timestamp": "2026-04-15T05:25:28.459943+00:00"
    },
    {
      "tool_name": "smell_detector_tool",
      "operation": "detect_new_smells",
      "status": "degraded",
      "error_code": null,
      "message": "No detector configured; using fallback.",
      "artifacts": {
        "new_smells": [],
        "detector_used": []
      },
      "timestamp": "2026-04-15T05:25:28.459943+00:00"
    }
  ]
}