{
  "task_id": "force_retry",
  "decision": "fail",
  "failure_stage": "static_validation",
  "symptom": "project compile failed",
  "location": {
    "file_path": "src/DemoClass.java",
    "class_name": "DemoClass",
    "method_name": "compute",
    "line_span": null
  },
  "risk_level": "high",
  "suggested_fix": "Retry with smaller patch scope and targeted fix.",
  "should_retry": false,
  "recommended_agent": "method_refactorer",
  "forbidden_actions_next_round": [
    "broad architectural rewrite",
    "ignore tool failures"
  ],
  "tool_observations": [
    {
      "tool_name": "patch_tool",
      "operation": "apply_patch",
      "status": "degraded",
      "error_code": null,
      "message": "repo_path missing; logical apply only.",
      "artifacts": {
        "applied": false,
        "check_pass": true
      },
      "timestamp": "2026-04-15T15:21:28.166596+00:00"
    },
    {
      "tool_name": "ast_tool",
      "operation": "parse_java",
      "status": "ok",
      "error_code": null,
      "message": "Heuristic parse success.",
      "artifacts": {
        "parsed": true,
        "engine": "heuristic"
      },
      "timestamp": "2026-04-15T15:21:28.166596+00:00"
    },
    {
      "tool_name": "build_tool",
      "operation": "compile_module",
      "status": "error",
      "error_code": "COMPILE_FAILED",
      "message": "forced failure for integration test",
      "artifacts": {
        "passed": false
      },
      "timestamp": "2026-04-15T15:21:28.166596+00:00"
    },
    {
      "tool_name": "build_tool",
      "operation": "compile_project",
      "status": "error",
      "error_code": "COMPILE_FAILED",
      "message": "forced failure for integration test",
      "artifacts": {
        "passed": false
      },
      "timestamp": "2026-04-15T15:21:28.166596+00:00"
    }
  ]
}